<!ENTITY % monthval "(1|2|3|4|5|6|7|8|9|10|11|12)">
<!ENTITY % dayval
	 "(1|2|3|4|5|6|7|8|9|10|11|12|13|14|15|16|17|18|19|20|21|22|23|24|25|26|27|28|29|30|31)">  
<!ENTITY % year "CDATA"> 
<!ENTITY % amp  "&#38;">


<!ENTITY % inline "img | keyword | a | highlight">
<!ENTITY % datainline "(#PCDATA | %inline; )*">
<!ENTITY % datainlineul "(#PCDATA | p | %inline; | ul)*">

<!ENTITY % coreattrs
	 "id       ID      #IMPLIED
	  class    CDATA   #IMPLIED
	  title    CDATA   #IMPLIED"
>

<!ENTITY % URI "CDATA">
 <!-- a Uniform Resource Identifier, see [RFC2396] -->

<!ENTITY % Length "CDATA">
<!-- nn for pixels or nn% for percentage length -->


<!ENTITY % Text "CDATA">
    <!-- used for titles etc. -->

    
<!ELEMENT game_studios
	  (studiodata,citation?,overview,notable_games,illustrations?)>

<!ATTLIST game_studios
	  %coreattrs;
	  id  ID #REQUIRED
	  main_genre    %Text;   #IMPLIED
	  status    (active|defunct)  #IMPLIED
	  year_of_first_game_published      %year;   #REQUIRED>

<!ELEMENT studiodata (name,headquarters+,founded,key_people+,number_of_employees)>
<!ATTLIST studiodata
	  %coreattrs;>

<!ELEMENT name %datainline;>
<!ATTLIST name
	  %coreattrs;>

<!ELEMENT headquarters %datainline;>
<!ATTLIST headquarters
	  %coreattrs;>

<!ELEMENT founded EMPTY>
<!ATTLIST founded
	  %coreattrs;
	  year     %year;       #REQUIRED
	  month    %monthval;   #IMPLIED
	  day      %dayval;     #IMPLIED
	  >

<!ELEMENT key_people %datainline;>
<!ATTLIST key_people
	  %coreattrs;
	  title  %Text;   #IMPLIED>

<!ELEMENT number_of_employees %datainline;>
<!ATTLIST number_of_employees
	%coreattrs;
	year     %year;       #IMPLIED
	month    %monthval;   #IMPLIED
	>

<!ELEMENT citation %datainline;>
<!ATTLIST citation
	  %coreattrs;
	  author %Text; #REQUIRED>



<!ELEMENT overview (history,milestones,current_projects*)>
<!ATTLIST overview
	  %coreattrs;
	  >


<!ELEMENT history %datainlineul;>
<!ATTLIST history
	  %coreattrs;
	  >

<!ELEMENT milestones %datainlineul;>
<!ATTLIST milestones
	  %coreattrs;
	  >


<!ELEMENT current_projects %datainlineul;>
<!ATTLIST current_projects
	  %coreattrs;
	  >



<!ELEMENT notable_games (game+)+>

<!ELEMENT game (gamedata,description,awards*)>
<!ATTLIST game
      %coreattrs;
      >

<!ELEMENT gamedata (game_name,released,publisher,platforms,genre)>
<!ATTLIST gamedata
				%coreattrs;>


<!ELEMENT game_name %datainline;>
<!ATTLIST game_name
		%coreattrs;>


<!ELEMENT released EMPTY>
<!ATTLIST released
		%coreattrs;
		year     %year;       #REQUIRED
		month    %monthval;   #IMPLIED?
		day      %dayval;     #IMPLIED
		>


<!ELEMENT publisher %datainline;>
<!ATTLIST publisher
		%coreattrs;>


<!ELEMENT platforms %datainline;>
<!ATTLIST platforms
		%coreattrs;>


<!ELEMENT genre %datainline;>
<!ATTLIST genre
		%coreattrs;>


<!ELEMENT description %datainlineul;>
<!ATTLIST description
    	%coreattrs;>


<!ELEMENT awards %datainlineul;>
<!ATTLIST awards
		%coreattrs;>



<!ELEMENT ul (li+)>

<!ELEMENT li %datainlineul;>
<!ATTLIST li
	  %coreattrs;
	  year     %year;       #REQUIRED
      month    %monthval;   #IMPLIED
      day      %dayval;     #IMPLIED
	  >


<!ELEMENT illustrations (img+)>
<!ATTLIST illustrations
	  %coreattrs;
	  >


<!ELEMENT img EMPTY>
<!ATTLIST img
	  %coreattrs;
	  src         %URI; #REQUIRED
	  alt         %Text; #REQUIRED
	  longdesc    %URI;          #IMPLIED
	  height      %Length;       #IMPLIED
	  width       %Length;       #IMPLIED
	  >



<!ELEMENT a (#PCDATA)*>
<!ATTLIST a
  %coreattrs;
  href        %URI;          #IMPLIED
>


<!ELEMENT highlight %datainline;>
<!ATTLIST highlight
	  %coreattrs;
	  >

<!ELEMENT p %datainline;>
<!ATTLIST p 
	  %coreattrs;
	  >
