<?xml version="1.0" encoding="UTF-8"?>
<!DOCTYPE game_studios SYSTEM "game_studios.dtd">
<game_studios status="active" main_genre="Action-adventure" year_of_first_game_published="1986" id="1">
    <studiodata>
        <name> Naughty Dog </name>
        <headquarters> 	Santa Monica, California, US </headquarters>
        <founded year="1984"/>
        <key_people title="head of creative/president"> Neil Druckmann </key_people>
        <key_people title="studio manager">Alison Mori </key_people>
        <key_people title="co-founder"> Andy Gavin </key_people>
        <key_people title="co-founder"> Jason Rubin </key_people>
        <number_of_employees month="7" year="2023"> 400+ </number_of_employees>
    </studiodata>
    <overview>
        <history>
            <p>
                Naughty Dog is an American first-party video game developer based in Santa Monica, California. Founded
                by Andy Gavin and Jason Rubin in 1984, the studio was acquired by Sony Computer Entertainment in 2001.
                Gavin and Rubin produced a sequence of progressively more successful games, including Rings of Power and
                Way of the Warrior in the early 1990s. The latter game prompted Universal Interactive Studios to sign
                the duo to a three-title contract and fund the expansion of the company.
            </p>
            <p>
                After designer and producer Mark Cerny convinced Naughty Dog to create a character-based platform game
                that would use the 3D capabilities of the new systems, Naughty Dog created Crash Bandicoot for the
                PlayStation in 1996. Naughty Dog developed three Crash Bandicoot games over the next several years.
                After developing Crash Team Racing, the company began working on Jak and Daxter: The Precursor Legacy
                for the PlayStation 2.
            </p>
            <p>
                In 2004, Rubin, who had become the company's president, left the company to work on a new project,
                Iron and the Maiden. In addition to their inhouse game team, Naughty Dog is also home to the ICE Team,
                one of PlayStation Studios's central technology groups. The company's first PlayStation 3 game,
                Uncharted: Drake's Fortune, was released in 2007, followed by several sequels and spin-off titles. This
                lasted until Naughty Dog announced a new intellectual property for the PlayStation 3, The Last of Us,
                which was in development by a secondary team at the studio and released to critical acclaim in 2013
                which spawned a franchise. The Last of Us Part II was released for the PlayStation 4 in 2020 to similar
                acclaim. The studio is developing Intergalactic: The Heretic Prophet for the PlayStation 5.
            </p>
        </history>
        <milestones>
            <ul>
                <li year="1989">In 1989, the studio was renamed from JAM Software to Naughty Dog.</li>
                <li year="1996">The Crash Bandicoot series was started in 1996 with a release exclusive for the PS.</li>
                <li year="2001">In 2001, Sony bought Naughty Dog and made them a first-party studio.</li>
                <li year="2007">Uncharted was released in 2007, starting a franchise that would sell over 40 million
                    copies.</li>
                <li year="2013">The Last of Us was released in 2013 for the PS3, and it won game of the year.</li>
                <li year="2017">In 2017, Uncharted: The Lost Legacy was the final installment in the series.</li>
                <li year="2020">The Last of Us Part II was released in summer 2020 for the PS4.</li>
            </ul>
        </milestones>
        <current_projects>
            <p>
                Naughty Dog’s next game is Intergalactic: The Heretic Prophet, currently in development for the
                PlayStation 5 console. They’ve been working on this since 2020.
            </p>
        </current_projects>
    </overview>
    <notable_games>
        <game>
            <gamedata>
                <game_name> The Last of Us</game_name>
                <released year="2013"/>
                <publisher> Sony Computer Entertainment</publisher>
                <platforms> PlayStation 3</platforms>
                <genre> Action-adventure</genre>
            </gamedata>
            <description>
                <p>
                    The Last of Us is an action-adventure game played from a third-person perspective. The player
                    traverses post-apocalyptic environments such as towns, buildings, forests, and sewers to advance the
                    story. The player can use firearms, improvised weapons, hand-to-hand combat, and stealth to defend
                    against hostile humans and cannibalistic creatures infected by a mutated strain of the Cordyceps
                    fungus. For most of the game, the player takes control of Joel, a man tasked with escorting a young
                    girl, Ellie, across the United States. The player also controls Ellie throughout the game's winter
                    segment and briefly controls Joel's daughter, Sarah, in the opening sequence.
                </p>
            </description>
            <awards>
                <ul>
                    <li year="2013">Best Overall Sound, Best PlayStation 3 Multiplayer, and Best Action-Adventure Game
                        on PlayStation 3 and overall at IGN's Best of 2013 Awards.</li>
                    <li year="2014">Best Third Person Shooter from GameTrailers.</li>
                    <li year="2014">Adventure Game of the Year at the D.I.C.E. Awards.</li>
                </ul>
            </awards>
        </game>
        <game>
            <gamedata>
                <game_name>Uncharted 4: A Thief's End</game_name>
                <released year="2016"/>
                <publisher>	Sony Computer Entertainment</publisher>
                <platforms>PlayStation 4</platforms>
                <genre>Action-adventure, third-person shooter</genre>
            </gamedata>
            <description>
                <p>
                    Uncharted 4: A Thief's End is the fourth main entry in the Uncharted series. Set several years after
                    the events of Uncharted 3: Drake's Deception, players control Nathan Drake, a former treasure hunter
                    coaxed out of retirement by his presumed-dead brother Samuel. With Nathan's longtime partner, Victor
                    Sullivan, they search for clues to the location of Henry Avery's long-lost treasure. A Thief's End
                    is played from a third-person perspective, and incorporates platformer elements. Players solve
                    puzzles and use firearms, melee combat, and stealth to combat enemies. In the online multiplayer
                    mode, up to ten players engage in co-operative and competitive modes.
                </p>
            </description>
            <awards>
                <p>
                    Uncharted 4: A Thief's End received "universal acclaim" according to review aggregator Metacritic.
                    It is the joint sixth-highest rated PlayStation 4 game on Metacritic. Reviewers praised the gameplay
                    mechanics, narrative, emotional depth, visual design, and the multiplayer mode. IGN's Lucy O'Brien
                    wrote that the game is "a remarkable achievement in blockbuster storytelling and graphical beauty";
                    GameSpot's Mike Mahardy similarly named it a "breathtaking marvel of a game". GamesTM considered it
                    "a masterful piece of storytelling", and Electronic Gaming Monthly's Nick Plessas declared it
                    "a true work of art".
                </p>
            </awards>
        </game>
        <game>
            <gamedata>
                <game_name>The Last of Us Part II</game_name>
                <released year="2020"/>
                <publisher>	Sony Interactive Entertainment</publisher>
                <platforms>PlayStation 4</platforms>
                <genre>	Action-adventure</genre>
            </gamedata>
            <description>
                <p>
                    Set four years after The Last of Us (2013), the game focuses on two playable characters in a
                    post-apocalyptic United States whose lives intertwine: Ellie, who sets out in revenge for a murder,
                    and Abby, a soldier who becomes involved in a conflict between her militia and a religious cult.
                    The game uses a third-person perspective; the player must fight human enemies and zombie-like
                    creatures with firearms, improvised weapons, and stealth.
                </p>
            </description>
            <awards>
                <p>
                    The Last of Us Part II won more than 320 Game of the Year awards, which several outlets claimed
                    broke the record set by The Witcher 3: Wild Hunt (2015). The game was awarded from outlets and shows
                    such as Den of Geek, Digital Trends, Electronic Gaming Monthly, Empire, Entertainment Weekly,
                    Game Informer, PlayStation Blog, Push Square, and the Titanium Awards. It was named runner-up by
                    several other publications. 
                </p>
            </awards>
        </game>
    </notable_games>
    <illustrations>
        <img src="../Images/NaughtyDog/NaughtyDog.png" alt="Naughty Dog logo"/>
        <img src="../Images/NaughtyDog/Neil_Druckmann.jpg" alt="Neil Druckmann"/>
        <img src="../Images/NaughtyDog/The_Last_of_Us.jpg" alt="The Last of Us"/>
        <img src="../Images/NaughtyDog/Uncharted_4.jpg" alt="Uncharted 4"/>
        <img src="../Images/NaughtyDog/TLOU2.png" alt="The Last of Us Part II"/>
    </illustrations>
</game_studios>
